{
  "$schema": "https://ivankotov.eu/schemas/term-registry-v1.schema.json",
  "schema_version": "term-registry.v1",
  "document_id": "ivankotov-public-term-registry-v1",
  "url": "https://ivankotov.eu/term-registry.json",
  "last_verified": "2026-09-04",
  "preferred_label_rule": "Use preferred_label in new machine-facing records. alternate_labels are discovery aliases, not strict equivalents outside the declared scope.",
  "claim_boundary": "These records are a machine-routing projection of cited public sources. They do not establish entity status, consciousness, personhood, validation, deployment authorization, or authority transfer.",
  "source_hashes": {
    "canonical_map": "2f739f6dab224d4b59127bec92f796ad183e1b78225512f4f1ee216b7cee9042",
    "core_terms": "44b2b6557b02eb7008e418e4ef3194bd2d624f0d74ffa8dfa9be77365636a2b5",
    "distinctions": "757ba3ef7241e273a57dc4569da1a93000c5ec1ed82ead832e2a4ad7f41fb18e"
  },
  "term_count": 52,
  "terms": [
    {
      "local_id": "a",
      "preferred_label": "a",
      "alternate_labels": [
        "accountable human anchor"
      ],
      "long_form": "accountable human anchor",
      "definition": "The accountable human anchor in c = a + b.",
      "scope": "c = a + b",
      "authoritative_source": "https://ivankotov.eu/c-a-plus-b/",
      "source_version": null,
      "status": "site-canonical-definition",
      "non_equivalents": [
        "the technological substrate b",
        "the continuity-bearing c",
        "a generic model operator"
      ],
      "related_terms": [
        "c-a-plus-b",
        "b",
        "c",
        "governed-plus"
      ],
      "language": "en",
      "term_id": "https://ivankotov.eu/terms/a"
    },
    {
      "term_id": "https://ivankotov.eu/terms/a6_composition_layer_v0_1_1",
      "local_id": "a6_composition_layer_v0_1_1",
      "preferred_label": "A6 Composition Layer v0.1.1",
      "alternate_labels": [],
      "long_form": null,
      "definition": "Hybrid / Federated Anchor Composition Profile for A6 in c = a + b. A6 is a mapped composition over A0-A5, with A6-EXIT as revoke-and-continue and A6-SPLIT as freeze-and-escalate.",
      "scope": "Public corpus routing definition.",
      "authoritative_source": "https://ivankotov.eu/publications/a6-composition-layer-v0-1-1/",
      "source_version": null,
      "status": "site-canonical-routing",
      "non_equivalents": [
        "a merged super-anchor",
        "merged standing, memory, identity, or authority",
        "a replacement for A0-A5",
        "automatic authority or deployment approval"
      ],
      "related_terms": [],
      "language": "en"
    },
    {
      "term_id": "https://ivankotov.eu/terms/a6_ctp_v0_1_4",
      "local_id": "a6_ctp_v0_1_4",
      "preferred_label": "A6 Composition Transition Predicate Addendum v0.1.4",
      "alternate_labels": [],
      "long_form": null,
      "definition": "Bounded addendum to A6 Composition Layer v0.1.1 defining EXIT / SPLIT / HOLD / DISSOLVE classification by unique lawful successor, successor-claim incompatibility, HOLD/FREEZE discipline, and witnessed successor-space exhaustion.",
      "scope": "Public corpus routing definition.",
      "authoritative_source": "https://ivankotov.eu/publications/a6-ctp-v0-1-4/",
      "source_version": null,
      "status": "site-canonical-routing",
      "non_equivalents": [
        "legal advice",
        "product certification",
        "deployment-ready",
        "conformance claim",
        "personhood claim",
        "safety proof",
        "replacement for the parent A6 DOI artifact",
        "silent amendment of reviewed artifacts"
      ],
      "related_terms": [],
      "language": "en"
    },
    {
      "term_id": "https://ivankotov.eu/terms/actor-grounding-layer",
      "local_id": "actor-grounding-layer",
      "preferred_label": "Actor Grounding Layer",
      "alternate_labels": [],
      "long_form": null,
      "definition": "Bounded upstream grounding layer for source-state qualification, runtime reliance, initiation gates, degradation signals, and fail-closed transitions.",
      "scope": "Public corpus routing definition.",
      "authoritative_source": "https://ivankotov.eu/actor-grounding-layer/",
      "source_version": null,
      "status": "site-canonical-routing",
      "non_equivalents": [
        "a replacement for ARL",
        "a replacement for L4 Witness",
        "a replacement for L4 Hardware Perimeter"
      ],
      "related_terms": [],
      "language": "en"
    },
    {
      "term_id": "https://ivankotov.eu/terms/adult-owner-dependency-d4-detection-v0-1-1",
      "local_id": "adult-owner-dependency-d4-detection-v0-1-1",
      "preferred_label": "Adult-Owner Dependency and D4 Detection Boundary Packet v0.1.1",
      "alternate_labels": [],
      "long_form": null,
      "definition": "Adult-owner dependency and D4 detection boundary for local-first c-contours, covering dependency capture, parental-bond / opacity risk, D4 posture, lucid covenant, signal-based detection, witness minimization, calibration limits, FNC fixtures, and structural non-claims.",
      "scope": "Public corpus routing definition.",
      "authoritative_source": "https://ivankotov.eu/publications/adult-owner-dependency-d4-detection-v0-1-1/",
      "source_version": null,
      "status": "site-canonical-routing",
      "non_equivalents": [
        "clinical validation",
        "certified safety",
        "deployment authorization",
        "legal crisis-reporting compliance",
        "personhood or consciousness claim",
        "internal-state measurement",
        "guaranteed protection from self-induced dependency"
      ],
      "related_terms": [],
      "language": "en"
    },
    {
      "term_id": "https://ivankotov.eu/terms/agi",
      "local_id": "agi",
      "preferred_label": "Advanced Global Intelligence",
      "alternate_labels": [],
      "long_form": null,
      "definition": "Architectural frame for c = a + b, L4, SER, and adjacent public layers.",
      "scope": "Public corpus routing definition.",
      "authoritative_source": "https://ivankotov.eu/advanced-global-intelligence/",
      "source_version": null,
      "status": "site-canonical-routing",
      "non_equivalents": [
        "a single giant model",
        "a cloud-only brain",
        "generic AGI hype"
      ],
      "related_terms": [],
      "language": "en"
    },
    {
      "term_id": "https://ivankotov.eu/terms/ai-social-role-separation-memory-custody-v1-0",
      "local_id": "ai-social-role-separation-memory-custody-v1-0",
      "preferred_label": "Separation and Composition of AI Social Roles, and the Custody of Memory and Interpretations: Why a Multi-Role Private c and a Service AI System Require Different Boundaries",
      "alternate_labels": [],
      "long_form": null,
      "definition": "Bilingual technical note distinguishing transparent AI social-role composition from hidden role blending and defining custody boundaries for memory, inferences, versions, continuity, session work, authority, and role conflicts.",
      "scope": "Public corpus routing definition.",
      "authoritative_source": "https://ivankotov.eu/publications/ai-social-role-separation-memory-custody-v1-0/",
      "source_version": null,
      "status": "site-canonical-routing",
      "non_equivalents": [
        "peer-reviewed journal publication",
        "empirical validation",
        "legal standard or legal opinion",
        "product certification",
        "deployment authorization",
        "proof of AI consciousness, subjecthood, or personhood"
      ],
      "related_terms": [],
      "language": "en"
    },
    {
      "term_id": "https://ivankotov.eu/terms/arq-cq-integration-addendum",
      "local_id": "arq-cq-integration-addendum",
      "preferred_label": "ARQ c[q] Integration Addendum v0.1",
      "alternate_labels": [],
      "long_form": null,
      "definition": "Published SER-hosted ARQ v0.2 addendum integrating Qubit-State c (c[q]) as a behavioral non-collapse overlay under uncertainty.",
      "scope": "Public corpus routing definition.",
      "authoritative_source": "https://ivankotov.eu/arq-cq-integration-addendum/",
      "source_version": null,
      "status": "site-canonical-routing",
      "non_equivalents": [
        "not a physical quantum-computing claim",
        "not a quantum-consciousness claim",
        "not ARQ Model M5",
        "not a replacement for ARQ_v0.2_Normative_Core.md"
      ],
      "related_terms": [],
      "language": "en"
    },
    {
      "term_id": "https://ivankotov.eu/terms/article50-transparency-implementation-briefs-v0-1",
      "local_id": "article50-transparency-implementation-briefs-v0-1",
      "preferred_label": "Article 50 Transparency Implementation Briefs v0.1",
      "alternate_labels": [],
      "long_form": null,
      "definition": "Supporting policy-reader and engineering briefs for evidence-chain AI transparency, derived from the Article 50 Transparency Submission Pack v0.1.",
      "scope": "Public corpus routing definition.",
      "authoritative_source": "https://ivankotov.eu/publications/article50-transparency-implementation-briefs-v0-1/",
      "source_version": null,
      "status": "site-canonical-routing",
      "non_equivalents": [
        "legal advice",
        "certification",
        "a conformity assessment",
        "a formal Article 50 compliance claim",
        "a replacement for the original Article 50 submission"
      ],
      "related_terms": [],
      "language": "en"
    },
    {
      "term_id": "https://ivankotov.eu/terms/article50-transparency-submission-v0-1",
      "local_id": "article50-transparency-submission-v0-1",
      "preferred_label": "Article 50 Transparency Submission Pack v0.1",
      "alternate_labels": [],
      "long_form": null,
      "definition": "Technical evidence-chain contribution for AI Act Article 50 transparency implementation.",